{
  "schemaVersion" : 1,
  "sessionID" : "EC95FF85-882E-45A5-97D2-9E8F3B4C12E3",
  "appBuild" : "42",
  "macOSVersion" : "15.0",
  "startedAt" : "2026-09-03T10:00:00Z",
  "endedAt" : null,
  "durationSeconds" : null,
  "completionStatus" : "interrupted",
  "capture" : {
    "state" : "interrupted",
    "scope" : { "applicationBundleIdentifiers" : [], "processIdentifiers" : [] },
    "microphone" : { "uniqueID" : "usb-001", "name" : "USB Microphone" },
    "outputDeviceChanges" : []
  },
  "tracks" : { "system" : null, "microphone" : null, "final" : null },
  "gaps" : [],
  "interruptions" : [{ "occurredAt" : "2026-09-03T10:01:00Z", "reason" : "microphoneDisconnected" }],
  "processing" : { "state" : "pending", "dependencyVersions" : {}, "configuration" : {}, "resamplingCorrections" : [], "delayCorrections" : [], "mixGains" : {}, "errors" : [] }
}
